{
  "$schema": "https://json-schema.org/draft/2020-12/schema",
  "$id": "https://juli.ai/schemas/agent-runtime/implementation-artifact.schema.json",
  "title": "Implementation Artifact",
  "description": "Executor Agent execution signal consumed by Review Agent and Meta Agent.",
  "type": "object",
  "additionalProperties": false,
  "required": [
    "schemaVersion",
    "artifactType",
    "issueId",
    "executorDomain",
    "phaseRunId",
    "startedAt",
    "completedAt",
    "executionDurationMs",
    "toolsUsed",
    "toolInvocationCount",
    "contextFilesLoaded",
    "skillsLoaded",
    "rulesLoaded",
    "mcpsUsed",
    "filesModified",
    "testsAdded",
    "testsUpdated",
    "redGreenRefactorEvidence",
    "implementationSummary",
    "assumptions",
    "risks"
  ],
  "properties": {
    "schemaVersion": {
      "type": "string",
      "pattern": "^\\d+\\.\\d+\\.\\d+$",
      "description": "Semver schema version. Current: 1.0.0"
    },
    "artifactType": {
      "const": "implementation"
    },
    "issueId": {
      "type": "integer",
      "minimum": 1
    },
    "executorDomain": {
      "type": "string",
      "enum": ["ui-ux", "backend", "data-platform", "machine-learning", "integrations"]
    },
    "phaseRunId": {
      "type": "string",
      "minLength": 1,
      "description": "Correlates all artifacts from one agent-phase execution."
    },
    "startedAt": {
      "type": "string",
      "format": "date-time"
    },
    "completedAt": {
      "type": "string",
      "format": "date-time"
    },
    "executionDurationMs": {
      "description": "#1732: exactly two shapes. A measured duration carries a positive integer; an unmeasured run carries {available: false, reason}. A zero is a measurement claim and is rejected — it reads as measured and is not one. Unavailable has a shape of its own.",
      "oneOf": [
        {
          "title": "measured",
          "type": "integer",
          "minimum": 1
        },
        {
          "title": "unavailable",
          "type": "object",
          "additionalProperties": false,
          "required": ["available", "reason"],
          "properties": {
            "available": { "const": false },
            "reason": { "type": "string", "minLength": 1 }
          }
        }
      ]
    },
    "tokenUsage": {
      "description": "#1441: exactly two shapes. A measured reading carries {input, output, total}; an unmeasured run carries {available: false, reason} and NO value key, matching assemble_evidence.unavailable(). Before this the field was optional but, when present, admitted only the measured shape — jointly unsatisfiable with check_implementation_artifact's hard requirement on tokenUsage.total, which is how an annotated {0,0,0} sentinel entered the corpus this epic measures. A zero is exactly as unsourceable as 1800000 and is the more convincing lie, so 'unavailable' now has a shape of its own and the value key is excluded from it by construction.",
      "type": "object",
      "oneOf": [
        {
          "title": "measured",
          "type": "object",
          "additionalProperties": false,
          "required": ["total"],
          "properties": {
            "input": { "type": "integer", "minimum": 0 },
            "output": { "type": "integer", "minimum": 0 },
            "cacheCreation": { "type": "integer", "minimum": 0 },
            "cacheRead": { "type": "integer", "minimum": 0 },
            "total": { "type": "integer", "minimum": 0 },
            "observedFrom": { "type": "string", "minLength": 1 }
          }
        },
        {
          "title": "unavailable",
          "type": "object",
          "additionalProperties": false,
          "required": ["available", "reason"],
          "properties": {
            "available": { "const": false },
            "reason": { "type": "string", "minLength": 1 }
          }
        }
      ]
    },
    "toolsUsed": {
      "type": "array",
      "items": {
        "type": "object",
        "additionalProperties": false,
        "required": ["toolName", "count", "stage"],
        "properties": {
          "toolName": { "type": "string", "minLength": 1 },
          "count": { "type": "integer", "minimum": 0 },
          "stage": {
            "type": "string",
            "enum": ["red", "green", "refactor", "implementation", "other"]
          }
        }
      }
    },
    "toolInvocationCount": {
      "description": "#1732: exactly two shapes. A measured count carries a positive integer; an unmeasured run carries {available: false, reason}. A zero is a measurement claim and is rejected — it reads as measured and is not one. Unavailable has a shape of its own.",
      "oneOf": [
        {
          "title": "measured",
          "type": "integer",
          "minimum": 1
        },
        {
          "title": "unavailable",
          "type": "object",
          "additionalProperties": false,
          "required": ["available", "reason"],
          "properties": {
            "available": { "const": false },
            "reason": { "type": "string", "minLength": 1 }
          }
        }
      ]
    },
    "contextFilesLoaded": {
      "type": "array",
      "items": { "type": "string", "minLength": 1 }
    },
    "skillsLoaded": {
      "type": "array",
      "items": { "type": "string", "minLength": 1 }
    },
    "rulesLoaded": {
      "type": "array",
      "items": { "type": "string", "minLength": 1 },
      "description": "Tier-2 .cursor/rules/*.mdc paths actually loaded."
    },
    "mcpsUsed": {
      "type": "array",
      "items": { "type": "string", "minLength": 1 },
      "description": "MCP server ids actually used; empty when none."
    },
    "filesModified": {
      "type": "array",
      "items": { "type": "string", "minLength": 1 }
    },
    "testsAdded": {
      "type": "array",
      "items": { "type": "string", "minLength": 1 }
    },
    "testsUpdated": {
      "type": "array",
      "items": { "type": "string", "minLength": 1 }
    },
    "redGreenRefactorEvidence": {
      "type": "array",
      "items": {
        "type": "object",
        "additionalProperties": false,
        "required": ["cycle"],
        "properties": {
          "cycle": { "type": "integer", "minimum": 1 },
          "failingTestEvidence": { "type": "string" },
          "passingTestEvidence": { "type": "string" },
          "refactorEvidence": { "type": "string" },
          "commands": {
            "type": "array",
            "items": {
              "type": "object",
              "additionalProperties": false,
              "required": ["command", "exitCode"],
              "properties": {
                "command": { "type": "string" },
                "exitCode": { "type": "integer" },
                "outputSummary": { "type": "string" }
              }
            }
          }
        }
      }
    },
    "implementationSummary": {
      "type": "string"
    },
    "assumptions": {
      "type": "array",
      "items": { "type": "string" }
    },
    "risks": {
      "type": "array",
      "items": { "type": "string" }
    },
    "releaseEvidencePlanId": {
      "type": "string",
      "minLength": 1,
      "description": "When publicRelease, must match Meta issueLoadProfile.releaseEvidencePlan.planId."
    }
  }
}
