{
  "schemaVersion": "1.0.0",
  "artifactType": "implementation",
  "issueId": 499,
  "executorDomain": "ui-ux",
  "phaseRunId": "499-20260725T081800",
  "startedAt": "2026-07-25T08:05:00Z",
  "completedAt": "2026-07-25T08:15:00Z",
  "executionDurationMs": 600000,
  "tokenUsage": {
    "input": 120000,
    "output": 45000,
    "total": 165000
  },
  "toolsUsed": [
    {
      "toolName": "Task",
      "count": 3,
      "stage": "implementation"
    },
    {
      "toolName": "Shell",
      "count": 20,
      "stage": "green"
    },
    {
      "toolName": "Write",
      "count": 12,
      "stage": "implementation"
    },
    {
      "toolName": "StrReplace",
      "count": 8,
      "stage": "refactor"
    }
  ],
  "toolInvocationCount": 60,
  "contextFilesLoaded": [
    "docs/adr/035-public-release-evidence-and-automatic-rollback.md",
    "docs/runbooks/demo-deploy-runbook.md",
    "apps/demo/MODULE.md",
    "agent-runtime/artifacts/release-evidence-plan-issue-499.json",
    ".cursor/skills/domain/ui-ux/SKILL.md"
  ],
  "skillsLoaded": [
    ".cursor/skills/domain/ui-ux/SKILL.md"
  ],
  "rulesLoaded": [
    ".cursor/rules/reliability.mdc",
    ".cursor/rules/code-quality.mdc"
  ],
  "mcpsUsed": [],
  "filesModified": [
    "apps/demo/next.config.ts",
    "infra/systemd/juli-demo.service",
    "infra/nginx/demo.app-juli.com.conf",
    "infra/scripts/build-demo.sh",
    "infra/scripts/verify-demo-static-assets.sh",
    "infra/scripts/smoke-test-demo.sh",
    "apps/demo/e2e/exit-gate/static-asset-render.spec.ts",
    "docs/runbooks/demo-deploy-runbook.md",
    "tests/unit/test_demo_runtime_packaging.py",
    "tests/unit/test_demo_static_asset_integrity.py",
    "tests/unit/test_demo_rollback_evidence.py",
    "agent-runtime/config/agent-runtime.config.yml",
    "agent-runtime/config/slice-routing.yml",
    "agent-runtime/scripts/ci/ensure_workflow_cache.py"
  ],
  "testsAdded": [
    "tests/unit/test_demo_runtime_packaging.py",
    "tests/unit/test_demo_static_asset_integrity.py",
    "tests/unit/test_demo_rollback_evidence.py",
    "apps/demo/e2e/exit-gate/static-asset-render.spec.ts"
  ],
  "testsUpdated": [],
  "redGreenRefactorEvidence": [
    {
      "cycle": 1,
      "failingTestEvidence": "test_demo_runtime_packaging RED: standalone mismatch vs systemd pnpm start",
      "passingTestEvidence": "6/6 test_demo_runtime_packaging.py green after next start model",
      "refactorEvidence": "Documented juli-web-aligned WorkingDirectory in systemd unit",
      "commands": [
        {
          "command": "python -m pytest tests/unit/test_demo_runtime_packaging.py -q",
          "exitCode": 0,
          "outputSummary": "6 passed"
        }
      ]
    },
    {
      "cycle": 2,
      "failingTestEvidence": "test_demo_static_asset_integrity RED on missing referenced JS/CSS fixtures",
      "passingTestEvidence": "7/7 asset integrity tests green; verify + smoke wired",
      "refactorEvidence": "Bash-3 compatible verify script; optional build-demo hook",
      "commands": [
        {
          "command": "python -m pytest tests/unit/test_demo_static_asset_integrity.py -q",
          "exitCode": 0,
          "outputSummary": "7 passed"
        }
      ]
    },
    {
      "cycle": 3,
      "failingTestEvidence": "rollback/runbook/playwright contract RED before ADR-035 section",
      "passingTestEvidence": "7/7 rollback evidence + 6/6 Playwright static-asset-render",
      "refactorEvidence": "Runbook release-evidence section; Home\u2192Decisions styled assertions",
      "commands": [
        {
          "command": "python -m pytest tests/unit/test_demo_rollback_evidence.py -q",
          "exitCode": 0,
          "outputSummary": "7 passed"
        },
        {
          "command": "pnpm --filter @juli/demo test:e2e -- e2e/exit-gate/static-asset-render.spec.ts",
          "exitCode": 0,
          "outputSummary": "6 passed"
        }
      ]
    }
  ],
  "implementationSummary": "Restored Demo static-asset delivery by aligning next build+start packaging, adding build/smoke HTML\u2192asset integrity checks, Playwright styled smoke, rollback evidence, and Meta epic registry + releaseEvidencePlan for #499.",
  "assumptions": [
    "VPS bridge path (not ECS #498) is the release evidence surface.",
    "Mock-only Demo; no backend/TikTok wiring."
  ],
  "risks": [
    "Live VPS still needs deploy of systemd unit WorkingDirectory change before public Demo recovers."
  ],
  "releaseEvidencePlanId": "rep-499-demo-static-asset-bridge"
}
