{
  "schemaVersion": "1.0.0",
  "artifactType": "implementation",
  "issueId": 532,
  "executorDomain": "integrations",
  "phaseRunId": "532-20260727T171800",
  "startedAt": "2026-07-27T17:18:00Z",
  "completedAt": "2026-07-27T17:35:00Z",
  "executionDurationMs": 1020000,
  "tokenUsage": {
    "input": 0,
    "output": 0,
    "total": 0
  },
  "toolsUsed": [],
  "toolInvocationCount": 0,
  "contextFilesLoaded": [
    "agent-runtime/artifacts/meta-prepare-issue-532.json",
    "backend/src/juli_backend/services/tiktok/webhook_catalog.py",
    "backend/src/juli_backend/services/webhook/MODULE.md",
    "backend/src/juli_backend/workers/services/polling/orchestrate.py",
    "tests/unit/test_material_analytics_enqueue.py"
  ],
  "skillsLoaded": [
    ".cursor/skills/domain/integrations/SKILL.md"
  ],
  "rulesLoaded": [
    ".cursor/rules/core-safety.mdc",
    ".cursor/rules/core-orchestration.mdc",
    ".cursor/rules/code-quality.mdc",
    ".cursor/rules/reliability.mdc"
  ],
  "mcpsUsed": [],
  "filesModified": [
    "backend/src/juli_backend/services/tiktok/webhook_catalog.py",
    "backend/src/juli_backend/services/webhook/main.py",
    "backend/src/juli_backend/services/webhook/material_dispatch.py",
    "backend/src/juli_backend/services/webhook/material_gate.py",
    "backend/src/juli_backend/services/webhook/material_handoff.py",
    "backend/src/juli_backend/services/webhook/material_worker.py",
    "backend/src/juli_backend/workers/services/polling/orchestrate.py",
    "backend/src/juli_backend/workers/services/polling/__init__.py",
    "backend/src/juli_backend/workers/tasks/material_analytics_precompute.py",
    "tests/unit/test_material_analytics_enqueue.py"
  ],
  "testsAdded": [
    "tests/unit/test_material_analytics_enqueue.py"
  ],
  "testsUpdated": [],
  "redGreenRefactorEvidence": [
    {
      "cycle": 1,
      "failingTestEvidence": "ImportError / ModuleNotFoundError for material_dispatch, material_gate, material_handoff \u2014 greenfield enqueue path did not exist before implementation",
      "passingTestEvidence": "32 tests in test_material_analytics_enqueue.py pass covering AC1\u2013AC5 (material enqueue, worker fetch+precompute, #68 coalesce, non-material skip, mutex)",
      "refactorEvidence": "Extracted InMemory/Redis MaterialEnqueueGate, Celery dispatcher pattern mirroring action_cards/dispatch.py, run_fujiwa_material_resource_fetch reuses _FUJIWA_POLL_STEPS + sync_analytics",
      "commands": [
        {
          "command": "PYTHONPATH=backend/src python -m pytest tests/unit/test_material_analytics_enqueue.py -v",
          "exitCode": 0,
          "outputSummary": "32 passed"
        }
      ]
    }
  ],
  "implementationSummary": "",
  "assumptions": [],
  "risks": []
}
