{
  "schemaVersion": "1.0.0",
  "artifactType": "implementation",
  "issueId": 617,
  "executorDomain": "backend",
  "phaseRunId": "2026-07-31T0122Z",
  "startedAt": "2026-07-31T01:22:56Z",
  "completedAt": "2026-07-31T01:22:56Z",
  "executionDurationMs": 0,
  "tokenUsage": {
    "input": 0,
    "output": 0,
    "total": 0
  },
  "toolsUsed": [],
  "toolInvocationCount": 0,
  "contextFilesLoaded": [],
  "skillsLoaded": [],
  "rulesLoaded": [],
  "mcpsUsed": [],
  "filesModified": [],
  "testsAdded": [],
  "testsUpdated": [],
  "redGreenRefactorEvidence": [],
  "implementationSummary": "",
  "assumptions": [],
  "risks": []
}
